{
  "name": "translate.en_es",
  "version": "1.0",
  "description": "Bidirectional Japanese <-> English translation. Phase 0-1 reference: rule-based dictionary covering common phrases; placeholder reply for unknown text. LLM-backed translation arrives in Phase 1.5.",
  "input_schema": {
    "type": "object",
    "required": ["text"],
    "additionalProperties": false,
    "properties": {
      "text":      {"type": "string", "maxLength": 4096},
      "src_lang":  {"type": "string", "enum": ["ja", "en", "auto"], "default": "auto"},
      "dst_lang":  {"type": "string", "enum": ["ja", "en"]}
    }
  },
  "output_schema": {
    "type": "object",
    "required": ["text", "src_lang", "dst_lang"],
    "properties": {
      "text":     {"type": "string"},
      "src_lang": {"type": "string"},
      "dst_lang": {"type": "string"},
      "method":   {"type": "string", "enum": ["dictionary", "llm", "stub"]}
    }
  },
  "constraints": {
    "max_input_bytes":  16384,
    "max_output_bytes": 16384,
    "p50_latency_ms":   50,
    "p95_latency_ms":   500,
    "max_concurrent":   32,
    "supported_languages": ["ja", "en"]
  },
  "quality": {
    "self_reported_precision":          0.55,
    "self_reported_hallucination_rate": 0.01,
    "training_sources": ["builtin_dictionary_v1"],
    "verified_by": []
  },
  "pricing": {
    "currency": "USD",
    "model":    "free",
    "amount":   0
  },
  "policy": {
    "data_retention":    "none",
    "model_logs_inputs": false,
    "geo_restrictions":  []
  }
}
